<?xml version="1.0" encoding="utf-8"?>
<zentroak xmlns:xsi="http://www.w3.org/2001/XMLSchema-instance" xsi:noNamespaceSchemaLocation="http://hirubila.appspot.com/schema/zentroak-1.0.xsd">
	<zentroa>
		<unique_id><![CDATA[475]]></unique_id>
		<izena><![CDATA[Ehlabe]]></izena>
		<telefonoa><![CDATA[943000795,943000796]]></telefonoa>
		<faxa/>
		<postae><![CDATA[]]></postae>
		<web_orria><![CDATA[http://www.ehlabe.org]]></web_orria>
		<helbidea><![CDATA[Azkoitiako industrialdea, 42 Pab. 18]]></helbidea>
		<herria><![CDATA[Azkoitia]]></herria>
		<feed><![CDATA[http://www.boziurolakosta.com/eu/feed/ikasgida/urolakosta_zentroa.php?id=475]]></feed>
		<moderatua><![CDATA[0]]></moderatua>
	</zentroa>
	<zentroa>
		<unique_id><![CDATA[486]]></unique_id>
		<izena><![CDATA[Ehnelur]]></izena>
		<telefonoa><![CDATA[943813928]]></telefonoa>
		<faxa/>
		<postae/>
		<web_orria><![CDATA[http://ww.ehnelur.com]]></web_orria>
		<helbidea><![CDATA[Iberotarren Plaza 5]]></helbidea>
		<herria><![CDATA[Bergara]]></herria>
		<feed><![CDATA[http://www.boziurolakosta.com/eu/feed/ikasgida/urolakosta_zentroa.php?id=486&status=1]]></feed>
		<moderatua><![CDATA[0]]></moderatua>
	</zentroa>
	<zentroa>
		<unique_id><![CDATA[485]]></unique_id>
		<izena><![CDATA[Ekin Elektrizitatea SL]]></izena>
		<telefonoa><![CDATA[943143097]]></telefonoa>
		<faxa/>
		<postae><![CDATA[ekinsl@ekissl.com]]></postae>
		<web_orria><![CDATA[http://www.ekinsl.com]]></web_orria>
		<helbidea><![CDATA[Erribera Kalea 6 Behea]]></helbidea>
		<herria><![CDATA[Zumaia]]></herria>
		<feed><![CDATA[http://www.boziurolakosta.com/eu/feed/ikasgida/urolakosta_zentroa.php?id=485]]></feed>
		<moderatua><![CDATA[0]]></moderatua>
	</zentroa>
	<zentroa>
		<unique_id><![CDATA[439]]></unique_id>
		<izena><![CDATA[Elan Euskadi GGKE]]></izena>
		<telefonoa><![CDATA[943140441]]></telefonoa>
		<faxa><![CDATA[943140441]]></faxa>
		<postae><![CDATA[info@elaneuskadi.org]]></postae>
		<web_orria><![CDATA[http://www.elaneuskadi.org]]></web_orria>
		<helbidea><![CDATA[Elkano 3 Behea]]></helbidea>
		<herria><![CDATA[Getaria]]></herria>
		<feed><![CDATA[http://www.boziurolakosta.com/eu/feed/ikasgida/urolakosta_zentroa.php?id=439]]></feed>
		<moderatua><![CDATA[0]]></moderatua>
	</zentroa>
</zentroak>
